text1,text2,label,idx,label_text,global_idx
The city councilmen refused the demonstrators a permit because they feared violence.,The city councilmen feared violence.,1,212,entailment,1000212
Joan made sure to thank Susan for all the help she had recieved.,Joan made sure to thank Susan for all the help Joan had recieved.,1,345,entailment,1000345
Grace was happy to trade me her sweater for my jacket. She thinks it looks dowdy on her.,The sweater looks dowdy on her.,1,108,entailment,1000108
"Since Chester was dependent on Uncle Vernon, he couldn't very well marry without his approval",Uncle Vernon couldn't very well marry without his approval,0,220,not entailment,1000220
"Fred and Alice had very warm down coats, but they were not prepared for the cold in Alaska.",coats were not prepared for the cold in Alaska.,0,113,not entailment,1000113
"Fred was supposed to run the dishwasher, but he put it off, because he wanted to watch TV. But the show turned out to be boring, so he changed his mind and turned it off.",He changed his mind and turned the TV off.,1,189,entailment,1000189
"Emma's mother had died long ago, and her place had been taken by an excellent woman as governess.",Emma's mother's place had been taken by an excellent woman as governess.,1,633,entailment,1000633
Kirilov ceded the presidency to Shatov because he was more popular.,Shatov was more popular.,1,235,entailment,1000235
"Bernard, who had not told the government official that he was less than 21 when he filed for a homestead claim, did not consider that he had done anything dishonest. Still, anyone who knew that he was 19 years old could take his claim away from him.",Anyone who knew that he was 19 years old could take his claim away from Bernard.,1,301,entailment,1000301
"The table was piled high with food, and on the floor beside it there were crocks, baskets, and a five-quart pail of milk.","Beside the table there were crocks, baskets, and a five-quart pail of milk.",1,38,entailment,1000038
"We went to the lake, because a shark had been seen at the ocean beach, so it was a dangerous place to swim.",The ocean beach was a dangerous place to swim.,1,418,entailment,1000418
So Mark slept. It was daylight when he woke with Warren's hand upon his shoulder.,It was daylight when he woke with Warren's hand upon Warren's shoulder.,0,512,not entailment,1000512
"A number of times Henry had been present at interviews which his father had had with noted detectives who desired his aid in solving perplexing mysteries, and those occasions stood out as red-letter days for him.",Those occasions stood out as red-letter days for Henry.,1,61,entailment,1000061
"In the middle of the outdoor concert, the rain started falling, and it continued until 10.",The concert continued until 10.,0,161,not entailment,1000161
"Always before, Larry had helped Dad with his work. But he could not help him now, for Dad said that his boss at the railroad company would not want anyone but him to work in the office.",He could not help Dad now.,1,37,entailment,1000037
Madonna fired her trainer because she couldn't stand her boyfriend.,The trainer couldn't stand her boyfriend.,0,542,not entailment,1000542
"Every day after dinner Mr. Schmidt took a long nap. Mark would let him sleep for an hour, then wake him up, scold him, and get him to work. He needed to get him to finish his work, because his work was beautiful.","Mark needed to get him to finish his work, because his work was beautiful.",1,369,entailment,1000369
Joe paid the detective after he received the final report on the case.,Joe received the final report on the case.,1,34,entailment,1000034
"The journalists interviewed the stars of the new movie. They were very persistent, so the interview lasted for a long time.","The stars were very persistent, so the interview lasted for a long time.",0,327,not entailment,1000327
"Sam took French classes from Adam, because he was eager to speak it fluently.",Adam was eager to speak it fluently.,0,535,not entailment,1000535
"Alice was dusting the living room and trying to find the button that Mama had hidden. No time today to look at old pictures in her favorite photo album. Today she had to hunt for a button, so she put the album on a chair without even opening it.",She put the album on a chair without even opening the button.,0,578,not entailment,1000578
"Fred and Alice had very warm down coats, but they were not enough for the cold in Alaska.",Fred and Alice were not enough for the cold in Alaska.,0,583,not entailment,1000583
The Dakota prairie lay so warm and bright under the shining sun that it did not seem possible that it had ever been swept by the winds and snows of that hard winter.,It did not seem possible that the sun had ever been swept by the winds and snows of that hard winter.,0,607,not entailment,1000607
"Then Dad figured out how much the man owed the store; to that he added the man's board-bill at the cook-shanty. He subtracted that amount from the man's wages, and made out his check",Dad subtracted that amount from the man's wages.,1,614,entailment,1000614
"Pam's parents came home and found her having sex with her boyfriend, Paul. They were furious about it.",Pam and Paul were furious about it.,0,186,not entailment,1000186
"Papa looked down at the children's faces, so puzzled and sad now. It was bad enough that they had to be denied so many things because he couldn't afford them.",He couldn't afford the faces.,0,309,not entailment,1000309
Bill passed the gameboy to John because his turn was over.,John's turn was over.,0,543,not entailment,1000543
"Even before they reached town, they could hear a sound like corn popping. Dora asked what it was, and Dad said it was firecrackers.",Dora asked what the sound was.,1,146,entailment,1000146
"I sallied out for a bit of food, more to pass the time than because I wanted it.","I sallied out for a bit of food, more to pass the time than because I wanted time.",0,411,not entailment,1000411
"The lawyer asked the witness a question, but he was reluctant to answer it.",The lawyer was reluctant to answer it.,0,384,not entailment,1000384
Anne gave birth to a daughter last month. She is a very charming woman.,Anne is a very charming woman.,1,511,entailment,1000511
"The sun was covered by a thick cloud all morning, but luckily, by the time the picnic started, it was out.",The sun was out.,1,144,entailment,1000144
Frank felt crushed when his longtime rival Bill revealed that he was the winner of the competition.,Bill was the winner of the competition.,1,357,entailment,1000357
"Fred and Alice had very warm down coats, but they were not prepared for the cold in Alaska.",Fred and Alice were not prepared for the cold in Alaska.,1,226,entailment,1000226
"Emma's mother had died long ago, and her place had been taken by an excellent woman as governess.",Emma's place had been taken by an excellent woman as governess.,0,596,not entailment,1000596
"The table was piled high with food, and on the floor beside it there were crocks, baskets, and a five-quart pail of milk.","Beside the floor there were crocks, baskets, and a five-quart pail of milk.",0,501,not entailment,1000501
"Every day after dinner Mr. Schmidt took a long nap. Mark would let him sleep for an hour, then wake him up, scold him, and get him to work. He needed to get him to finish his work, because his work was beautiful.",Mr. Schmidt's work was beautiful.,1,111,entailment,1000111
"Dan took the rear seat while Bill claimed the front because his ""Dibs!"" was quicker.","Dan took the rear seat while Bill claimed the front because Bill's ""Dibs!"" was quicker.",1,336,entailment,1000336
Carol believed that Rebecca suspected that she had stolen the watch.,Carol believed that Rebecca suspected that Carol had stolen the watch.,1,280,entailment,1000280
"Alice was dusting the living room and trying to find the button that Mama had hidden. No time today to look at old pictures in her favorite photo album. Today she had to hunt for a button, so she put the album on a chair without even opening it.",She put the album on a chair without even opening the album.,1,482,entailment,1000482
"The donkey wished a wart on its hind leg would disappear, and it did.","The donkey wished a wart on its hind leg would disappear, and wart did.",1,306,entailment,1000306
"I sallied out for a bit of food, more to pass the time than because I wanted it.","I sallied out for a bit of food, more to pass the time than because I wanted food.",1,33,entailment,1000033
Of one thing Mark was sure. Harry knew much less than he did.,Harry knew much less than Harry did.,0,219,not entailment,1000219
"We had hoped to place copies of our newsletter on all the chairs in the auditorium, but there were simply not enough of them.",There were simply not enough copies of the newsletter.,1,8,entailment,1000008
"Alice tried frantically to stop her daughter from chatting at the party, leaving us to wonder why she was behaving so strangely.",Alice's daughter was behaving so strangely.,0,58,not entailment,1000058
"In the storm, the tree fell down and crashed through the roof of my house. Now, I have to get it repaired.",Now I have to get The tree repaired.,0,447,not entailment,1000447
"Adam can't leave work here until Bob arrives to replace him. If Bob had left home for work on time, he would be here by this time.",Adam would be here by this time.,0,366,not entailment,1000366
"I saw Jim yelling at some guy in a military uniform with a huge red beard. I don't know who he was, but he looked very unhappy.","I don't know who the guy in uniform was, but he looked very unhappy.",1,378,entailment,1000378
"Always before, Larry had helped Dad with his work. But he could not help him now, for Dad said that his boss at the railroad company would not want anyone but him to work in the office.",Larry's boss at the railroad company would not want anyone but him to work in the office.,0,547,not entailment,1000547
The foxes are getting in at night and attacking the chickens. They have gotten very nervous.,The foxes have gotten very nervous.,0,224,not entailment,1000224
"Tom said ""Check"" to Ralph as he took his bishop.","Tom said ""Check"" to Ralph as he took Ralph's bishop.",1,32,entailment,1000032
"When Tatyana reached the cabin, her mother was sleeping. She was careful not to disturb her, undressing and climbing back into her berth.","Tatyana was careful not to disturb her, undressing and climbing back into her berth.",1,125,entailment,1000125
"All the buttons up the back of Dora's plaid dress were buttoned outside-in. Maude should have thought to button her up; but no, she had left poor little Dora to do the best she could, alone.","She had left poor little Dora to do the best Dora could, alone.",1,520,entailment,1000520
"I saw Jim yelling at some guy in a military uniform with a huge red beard. I don't know who he was, but he looked very unhappy.","I don't know who Jim was, but he looked very unhappy.",0,477,not entailment,1000477
"Alice was dusting the living room and trying to find the button that Mama had hidden. No time today to look at old pictures in her favorite photo album. Today she had to hunt for a button, so she put the album on a chair without even opening it.",Alice had to hunt for a button.,1,529,entailment,1000529
"Always before, Larry had helped Dad with his work. But he could not help him now, for Dad said that his boss at the railroad company would not want anyone but him to work in the office.",Dad's boss at the railroad company would not want anyone but him to work in the office.,1,325,entailment,1000325
"Alice was dusting the living room and trying to find the button that Mama had hidden. No time today to look at old pictures in her favorite photo album. Today she had to hunt for a button, so she put the album on a chair without even opening it.",No time today to look at old pictures in Alice's favorite photo album.,1,407,entailment,1000407
The politicians far away in Washington could not know the settlers so they must make rules to regulate them.,They must make rules to regular the settlers.,1,340,entailment,1000340
There is a gap in the wall. You can see the garden behind it.,You can see the garden through the wall.,1,142,entailment,1000142
"Although they ran at about the same speed, Sue beat Sally because she had such a good start.",Sue had such a good start.,1,107,entailment,1000107
Fred watched TV while George went out to buy groceries. After an hour he got up.,Fred got up.,1,562,entailment,1000562
Jim signaled the barman and gestured toward his bathroom key.,Jim signaled the barman and gestured toward Jim's bathroom key.,0,242,not entailment,1000242
The sculpture rolled off the shelf because it wasn't anchored.,The sculpture wasn't anchored.,1,279,entailment,1000279
Mark heard Steve's feet going down the ladder. The door of the shop closed after him. He ran to look out the window.,The door of the shop closed after Mark.,0,75,not entailment,1000075
"Although they ran at about the same speed, Sue beat Sally because she had such a bad start.",Sally had such a bad start.,1,634,entailment,1000634
The foxes are getting in at night and attacking the chickens. They have gotten very bold.,The foxes have gotten very bold.,1,18,entailment,1000018
The storekeepers stayed in town to run their stores and lived in the rooms behind them.,The storekeepers stayed in town to run their stores and lived in the rooms behind the storekeepers.,0,323,not entailment,1000323
I couldn't put the pot on the shelf because it was too tall.,The shelf was too tall.,0,244,not entailment,1000244
The delivery truck zoomed by the school bus because it was going so fast.,The delivery truck was going so fast.,1,445,entailment,1000445
"If the con artist has succeeded in fooling Sam, he would have lost a lot of money.",Sam would have lost a lot of money.,1,258,entailment,1000258
Of one thing Mark was sure. Harry knew much less than he did.,Harry knew much less than Mark did.,1,164,entailment,1000164
"Tatyana managed two guitars and a bag, and still could point out the Freemans: ""Isn't it nice that they have come, Mama!""","Isn't it nice that the Freemans have come, Mama!""",1,318,entailment,1000318
"The signs over the shops' doors had pictures that indicated what work was done inside. Although more and more people were learning how to read, each artisan still had signs, not wishing to lose a possible patron merely because he happened to be illiterate.","Each artisan still had signs, not wishing to lose a possible patron merely because the patron happened to be illiterate.",1,334,entailment,1000334
Tom threw his schoolbag down to Ray after he reached the bottom of the stairs.,Tom reached the bottom of the stairs.,0,527,not entailment,1000527
"When Tatyana reached the cabin, her mother was sleeping. She was careful not to disturb her, undressing and climbing back into her berth.","mother was careful not to disturb her, undressing and climbing back into her berth.",0,4,not entailment,1000004
"When Tatyana reached the cabin, her mother was sleeping. She was careful not to disturb her , undressing and climbing back into her berth.","She was careful not to disturb Tatyana , undressing and climbing back into her berth.",0,429,not entailment,1000429
Mama came over and sat down beside Alice. Gently she stroked her hair and let the child weep.,Mama stroked her hair and let the child weep.,1,97,entailment,1000097
"Sam and Amy are passionately in love, but Amy's parents are unhappy about it, because they are fifteen.",Amy's parents are fifteen.,0,431,not entailment,1000431
John was doing research in the library when he heard a man humming and whistling. He was very annoyed.,John was very annoyed.,1,170,entailment,1000170
"Adam can't leave work here until Bob arrives to replace him. If Bob had left home for work on time, he would be gone by this time.",Adam would be gone by this time.,1,299,entailment,1000299
"We had hoped to place copies of our newsletter on all the chairs in the auditorium, but there were simply not enough of them.",There were simply not enough chairs.,0,509,not entailment,1000509
"I couldn't find a spoon, so I tried using a pen to stir my coffee. But that turned out to be a bad idea, because it got full of ink.",The pen got full of ink.,0,137,not entailment,1000137
Sam's drawing was hung just above Tina's and it did look much better with another one above it.,Sam's drawing did look much better with another one above it.,0,439,not entailment,1000439
"Joe's uncle can still beat him at tennis, even though he is 30 years older.",Joe is 30 years older.,0,26,not entailment,1000026
"Susan knew that Ann's son had been in a car accident, so she told her about it.",Susan told her about it.,1,266,entailment,1000266
The trophy doesn't fit into the brown suitcase because it is too large.,The suitcase is too large.,0,25,not entailment,1000025
"Dan took the rear seat while Bill claimed the front because his ""Dibs!"" was quicker.","Dan took the rear seat while Bill claimed the front because Dan's ""Dibs!"" was quicker.",0,217,not entailment,1000217
"The table was piled high with food, and on the floor beside it there were crocks, baskets, and a five-quart pail of milk.","Beside the food there were crocks, baskets, and a five-quart pail of milk.",0,424,not entailment,1000424
Mama came over and sat down beside Alice. Gently she stroked her hair and let the child weep.,She stroked Alice's hair and let the child weep.,1,342,entailment,1000342
Madonna fired her trainer because she slept with her boyfriend.,The trainer slept with her boyfriend.,1,293,entailment,1000293
"When they had eventually calmed down a bit, and had gotten home, Mr. Farley put the magic pebble in an iron safe. Some day they might want to use it , but really for now, what more could they wish for?",Some day they might want to use the magic pebble.,1,549,entailment,1000549
"We went to the lake, because a shark had been seen at the ocean beach, so it was a dangerous place to swim.",The lake was a dangerous place to swim.,0,440,not entailment,1000440
Bill passed the half-empty plate to John because he was hungry.,Bill was hungry.,0,515,not entailment,1000515
I'm sure that my map will show this building; it is very good.,The map is very good.,1,172,entailment,1000172
"It is not easy to space buttonholes exactly the same distance apart, and it is very difficult to cut them precisely the right size. The tiniest slip of the scissors will make the hole too large, and even one thread uncut will leave it too small.",Even one thread uncut will leave the slip too small.,0,207,not entailment,1000207
"The actress used to be named Terpsichore, but she changed it to Tina a few years ago, because she figured it was too hard to pronounce.",Tina was too hard to pronounce.,0,474,not entailment,1000474
"I couldn't find a spoon, so I tried using a pen to stir my coffee. But that turned out to be a bad idea, because it got full of coffee.",The coffee got full of coffee.,0,284,not entailment,1000284
"Papa looked down at the children's faces, so puzzled and sad now. It was bad enough that they had to be denied so many things because he couldn't afford them.",It was bad enough that the children had to be denied so many things because he couldn't afford them.,1,554,entailment,1000554
"As Andrea in the crop duster passed over Susan, she could see the landing gear.",Andrea could see the landing gear.,0,341,not entailment,1000341
Susan knows all about Ann's personal problems because she is nosy.,Susan is nosy.,1,481,entailment,1000481
Sid explained his theory to Mark but he couldn't convince him.,Mark couldn't convince him.,0,229,not entailment,1000229
Joe has sold his house and bought a new one a few miles away. He will be moving into it on Thursday.,He will be moving into The new house on Thursday.,1,36,entailment,1000036
Sid explained his theory to Mark but he couldn't understand him.,Mark couldn't understand him.,1,617,entailment,1000617
This book introduced Shakespeare to Goethe; it was a fine selection of his writing.,It was a fine selection of Goethe's writing.,0,465,not entailment,1000465
"Mary tucked her daughter Anne into bed, so that she could work.","Mary tucked her daughter Anne into bed, so that Mary could work.",1,282,entailment,1000282
"Adam can't leave work here until Bob arrives to replace him. If Bob had left home for work on time, he would be gone by this time.",Bob would be gone by this time.,0,500,not entailment,1000500
At the Loebner competition the judges couldn't figure out which respondents were the chatbots because they were so stupid.,The judges were so stupid.,1,251,entailment,1000251
"Everyone really loved the oatmeal cookies; only a few people liked the chocolate chip cookies. Next time, we should make fewer of them.",We should make fewer of the chocolate chip cookies.,1,371,entailment,1000371
"Lily spoke to Donna, breaking her silence.","Lily spoke to Donna, breaking Lily's silence.",1,275,entailment,1000275
Steve follows Fred's example in everything. He admires him hugely.,Steve admires him hugely.,1,427,entailment,1000427
The foxes are getting in at night and attacking the chickens. I shall have to guard them.,I shall have to guard The foxes.,0,403,not entailment,1000403
"Always before, Larry had helped Dad with his work. But he could not help him now, for Dad said that his boss at the railroad company would not want anyone but him to work in the office.",Dad could not help him now.,0,14,not entailment,1000014
The firemen arrived before the police because they were coming from so far away.,The firemen were coming from so far away.,0,162,not entailment,1000162
"Archaeologists have concluded that humans lived in Laputa 20,000 years ago. They hunted for evidence on the river banks.",Archaeologists hunted for evidence on the river banks.,1,287,entailment,1000287
"Jackson was greatly influenced by Arnold, though he lived two centuries earlier.",Arnold lived two centuries earlier.,1,40,entailment,1000040
Sara borrowed the book from the library because she needs it for an article she is working on. She writes it when she gets home from work.,She writes the article when she gets home from work.,1,406,entailment,1000406
"Beth didn't get angry with Sally, who had cut her off, because she stopped and apologized.",Beth stopped and apologized.,0,517,not entailment,1000517
"Grant worked hard to harvest his beans so he and his family would have enough to eat that winter, His friend Henry let him stack them in his barn where they would dry. Later, he and Tatyana would shell them and cook them for their Sunday dinners.","Later, he and Tatyana would shell them and cook them for his and Tatyana's Sunday dinners.",1,326,entailment,1000326
"I couldn't find a spoon, so I tried using a pen to stir my coffee. But that turned out to be a bad idea, because it got full of ink.",The coffee got full of ink.,1,134,entailment,1000134
"Mark became absorbed in Blaze, the white horse. He was afraid the stable boys at the Burlington Stables struck at him and bullied him because he was timid, so he took upon himself the feeding and care of the animal.",Blaze was afraid the stable boys at the Burlington Stables struck at him and bullied him.,0,510,not entailment,1000510
"Mr. Moncrieff visited Chester's luxurious New York apartment, thinking that it belonged to his son Edward. The result was that Mr. Moncrieff has decided to cancel Edward's allowance on the ground that he no longer requires his financial support.",Chester no longer requires his financial support.,0,415,not entailment,1000415
"I tried to paint a picture of an orchard, with lemons in the lemon trees, but they came out looking more like telephone poles.",The lemon trees came out looking more like telephone poles.,1,183,entailment,1000183
John was doing research in the library when he heard a man humming and whistling. He was very annoying.,The man was very annoying.,1,505,entailment,1000505
The customer walked into the bank and stabbed one of the tellers. He was immediately taken to the hospital.,The customer was immediately taken to the hospital.,0,95,not entailment,1000095
"Even before they reached town, they could hear a sound like corn popping. Dora asked what it was, and Dad said it was firecrackers.",Dora asked what the corn was.,0,526,not entailment,1000526
"I was trying to open the lock with the key, but someone had filled the keyhole with chewing gum, and I couldn't get it out.",I couldn't get the key out.,0,352,not entailment,1000352
"Although they ran at about the same speed, Sue beat Sally because she had such a bad start.",Sue had such a bad start.,0,53,not entailment,1000053
Jim yelled at Kevin because he was so upset.,Kevin was so upset.,0,455,not entailment,1000455
Many people start to read Paul's books and can't put them down. They are popular because Paul writes so well.,Paul's books are popular because Paul writes so well.,1,373,entailment,1000373
"George got free tickets to the play, but he gave them to Eric, even though he was particularly eager to see it.",George was particularly eager to see it.,1,491,entailment,1000491
"I used an old rag to clean the knife, and then I put it in the trash.",I put the knife in the trash.,0,624,not entailment,1000624
Jane knocked on Susan's door but she did not get an answer.,Jane did not get an answer.,1,479,entailment,1000479
Tom threw his schoolbag down to Ray after he reached the bottom of the stairs.,Ray reached the bottom of the stairs.,1,389,entailment,1000389
"Lionel is holding captive a scientist, Dr. Vardi, who has invented a device that turns animals invisible; Lionel plans to use it on Geoffrey and send him to steal nuclear material from an army vault.",Lionel plans to use it on Geoffrey and send Lionel to steal nuclear material from an army vault.,0,17,not entailment,1000017
