text1,text2,label,idx,label_text,global_idx
Men had the right to keep their sons working for them until they were 21 years of age.,Men had the right to keep their sons working for them until the sons were 21 years of age.,1,313,entailment,1000313
"Mark became absorbed in Blaze, the white horse. He was afraid the stable boys at the Burlington Stables struck at him and bullied him because he was timid, so he took upon himself the feeding and care of the animal.",Blaze took upon himself the feeding and care of the animal.,0,198,not entailment,1000198
"During a game of tag, Ethan chased Luke because he was ""it"".","Luke was ""it"".",0,141,not entailment,1000141
The painting in Mark's living room shows an oak tree. It is to the right of the bookcase.,The oak tree is to the right of the bookcase.,0,494,not entailment,1000494
"Lionel is holding captive a scientist, Dr. Vardi, who has invented a device that turns animals invisible; Lionel plans to use it on Geoffrey and send him to steal nuclear material from an army vault.",Lionel plans to use it on Geoffrey and send Dr. Vardi to steal nuclear material from an army vault.,0,561,not entailment,1000561
"George got free tickets to the play, but he gave them to Eric, because he was particularly eager to see it.",George was particularly eager to see it.,0,5,not entailment,1000005
Joan made sure to thank Susan for all the help she had given.,Joan made sure to thank Susan for all the help Joan had given.,0,432,not entailment,1000432
"Archaeologists have concluded that humans lived in Laputa 20,000 years ago. They hunted for evidence on the river banks.",Prehistoric humans hunted for evidence on the river banks.,0,570,not entailment,1000570
The man lifted the boy onto his bunk bed.,The man lifted the boy onto the boy's bunk bed.,1,442,entailment,1000442
Sam broke both his ankles and he's walking with crutches. But a month or so from now they should be unnecessary.,The ankles should be unnecessary.,0,532,not entailment,1000532
"By rolling over in her upper berth, Tatyana could look over the edge of it and see her mother plainly. How very small and straight and rigid she lay in the bunk below! Her eyes were closed, but Tatyana doubted if she slept.",Tatyana doubted if her mother slept.,1,100,entailment,1000100
The sculpture rolled off the shelf because it wasn't level.,The sculpture wasn't level.,0,435,not entailment,1000435
Joe paid the detective after he delivered the final report on the case.,Joe delivered the final report on the case.,0,272,not entailment,1000272
The fish ate the worm. It was hungry.,The worm was hungry.,0,80,not entailment,1000080
"There is a pillar between me and the stage, and I can't see it.",I can't see around the pillar.,0,611,not entailment,1000611
The politicians far away in Washington could not know the settlers so they must make rules to regulate them.,They must make rules to regular the politicians.,0,64,not entailment,1000064
Emma did not pass the ball to Janie although she saw that she was open.,Janie saw that she was open.,0,104,not entailment,1000104
Sam Goodman's biography of the Spartan general Xenophanes conveys a vivid sense of the difficulties he faced in his childhood.,Sam Goodman's biography of the Spartan general Xenophanes conveys a vivid sense of the difficulties Goodman faced in his childhood.,0,502,not entailment,1000502
Tom gave Ralph a lift to school so he wouldn't have to drive alone.,Ralph wouldn't have to drive alone.,0,525,not entailment,1000525
"Bob was playing cards with Adam and was way ahead. If Adam hadn't had a sudden run of good luck, he would have lost.",Adam would have lost.,1,391,entailment,1000391
Dan had to stop Bill from toying with the injured bird. He is very compassionate.,Dan is very compassionate.,1,294,entailment,1000294
The man lifted the boy onto his bunk bed.,The man lifted the boy onto the man's bunk bed.,0,585,not entailment,1000585
"The path to the lake was blocked, so we couldn't reach it.",We couldn't reach the path.,0,582,not entailment,1000582
I couldn't put the pot on the shelf because it was too tall.,The pot was too tall.,1,7,entailment,1000007
Madonna fired her trainer because she couldn't stand her boyfriend.,Madonna couldn't stand her boyfriend.,1,627,entailment,1000627
"The sack of potatoes had been placed below the bag of flour, so it had to be moved first.",The sack of potatoes had to be moved first.,0,308,not entailment,1000308
"Pam's parents came home and found her having sex with her boyfriend, Paul. They were embarrassed about it.",Pam's parents were embarrassed about it.,0,534,not entailment,1000534
"John promised Bill to leave, so an hour later he left.",Bill left.,0,46,not entailment,1000046
The painting in Mark's living room shows an oak tree. It is to the right of the bookcase.,The painting is to the right of the bookcase.,1,319,entailment,1000319
"Jane knocked on Susan's door, but there was no answer. She was disappointed.",Jane was disappointed.,1,573,entailment,1000573
I put the butterfly wing on the table and it broke.,The table broke.,0,22,not entailment,1000022
Jim comforted Kevin because he was so upset.,Jim was so upset.,0,619,not entailment,1000619
"Jane knocked on Susan's door, but there was no answer. She was out.",Jane was out.,0,254,not entailment,1000254
"Mr. Moncrieff visited Chester's luxurious New York apartment, thinking that it belonged to his son Edward. The result was that Mr. Moncrieff has decided to cancel Edward's allowance on the ground that he no longer requires his financial support.",Mr. Moncrieff no longer requires his financial support.,0,332,not entailment,1000332
John couldn't see the stage with Billy in front of him because he is so tall.,John is so tall.,0,393,not entailment,1000393
"I sat there feeling rather like a chappie I'd once read about in a book, who murdered another cove and hid the body under the dining-room table, and then had to be the life and soul of a dinner party, with it there all the time.","He had to be the life and soul of a dinner party, with the life and soul there all the time.",0,618,not entailment,1000618
"The donkey wished a wart on its hind leg would disappear, and it did.","The donkey wished a wart on its hind leg would disappear, and donkey did.",0,375,not entailment,1000375
John couldn't see the stage with Billy in front of him because he is so short.,John is so short.,1,1,entailment,1000001
"I used an old rag to clean the knife, and then I put it in the drawer.",I put the knife in the drawer.,1,311,entailment,1000311
Steve follows Fred's example in everything. He influences him hugely.,Fred influences him hugely.,1,130,entailment,1000130
There is a gap in the wall. You can see the garden through it.,You can see the garden through the wall.,0,264,not entailment,1000264
The Wainwrights treated Mr. Crowley like a prince until he made his will in their favor; then they treated him like dirt. Folks said he died just to be rid of their everlasting nagging.,Folks said he died just to be ride of the Wainwrights' everlasting nagging.,1,473,entailment,1000473
Jane knocked on Susan's door but she did not get an answer.,Susan did not get an answer.,0,20,not entailment,1000020
"John promised Bill to leave, so an hour later he left.",John left.,1,71,entailment,1000071
The fish ate the worm. It was tasty.,The fish was tasty.,0,486,not entailment,1000486
"Equally swoon-worthy is C.K. Dexter Haven, a pallid young dandy holding a jade-handled walking stick, with a poodle asleep at his feet.","Equally swoon-worthy is C.K. Dexter Haven, a pallid young dandy holding a jade-handled walking stick, with a poodle asleep at Haven's feet.",1,73,entailment,1000073
Mary took out her flute and played one of her favorite pieces. She has loved it since she was a child.,She has loved the piece since she was a child.,1,171,entailment,1000171
Steve follows Fred's example in everything. He admires him hugely.,Fred admires him hugely.,0,154,not entailment,1000154
I took the water bottle out of the backpack so that it would be handy.,I took the water bottle out of the backpack so that the water bottle would be handy.,1,230,entailment,1000230
Frank felt crushed when his longtime rival Bill revealed that he was the winner of the competition.,Frank was the winner of the competition.,0,260,not entailment,1000260
"Mark was close to Mr. Singer's heels. He heard him calling for the captain, promising him, in the jargon everyone talked that night, that not one thing should be damaged on the ship except only the ammunition, but the captain and all his crew had best stay in the cabin until the work was over.",The captain and all Mr. Singer's crew had best stay in the cabin until the work was over.,0,599,not entailment,1000599
"Fred is the only man alive who still remembers my father as an infant. When Fred first saw my father, he was twelve years old.","When Fred first saw my father, Fred was twelve years old.",1,372,entailment,1000372
"It is not easy to space buttonholes exactly the same distance apart, and it is very difficult to cut them precisely the right size. The tiniest slip of the scissors will make the hole too large, and even one thread uncut will leave it too small.",Even one thread uncut will leave the hole too small.,1,620,entailment,1000620
John was doing research in the library when he heard a man humming and whistling. He was very annoyed.,The man was very annoyed.,0,206,not entailment,1000206
Sam broke both his ankles and he's walking with crutches. But a month or so from now they should be better.,The ankles should be better.,1,408,entailment,1000408
At the Loebner competition the judges couldn't figure out which respondents were the chatbots because they were so stupid.,The chatbots were so stupid.,0,376,not entailment,1000376
So Mark slept. It was daylight when he woke with Warren's hand upon his shoulder.,It was daylight when he woke with Warren's hand upon Mark's shoulder.,1,443,entailment,1000443
Joe has sold his house and bought a new one a few miles away. He will be moving into it on Thursday.,He will be moving into The old house on Thursday.,0,533,not entailment,1000533
Sara borrowed the book from the library because she needs it for an article she is working on. She writes it when she gets home from work.,She writes the book when she gets home from work.,0,45,not entailment,1000045
The woman held the girl against her will.,The woman held the girl against the girl's will.,1,587,entailment,1000587
I poured water from the bottle into the cup until it was full.,The cup was full.,1,201,entailment,1000201
"It was a summer afternoon, and the dog was sitting in the middle of the lawn. After a while, it got up and moved to a spot under the tree, because it was cooler.",The dog was cooler.,0,416,not entailment,1000416
"Joe's uncle can still beat him at tennis, even though he is 30 years younger.",Joe is 30 years younger.,1,88,entailment,1000088
"Ann asked Mary what time the library closes, because she had forgotten.",Ann had forgotten.,1,91,entailment,1000091
"The lawyer asked the witness a question, but he was reluctant to answer it.",The witness was reluctant to answer it.,1,246,entailment,1000246
Billy cried because Toby wouldn't share his toy.,Billy cried because Toby wouldn't share Billy's toy.,0,498,not entailment,1000498
Frank felt vindicated when his longtime rival Bill revealed that he was the winner of the competition.,Frank was the winner of the competition.,1,167,entailment,1000167
Joan made sure to thank Susan for all the help she had recieved.,Joan made sure to thank Susan for all the help Susan had recieved.,0,385,not entailment,1000385
Bob collapsed on the sidewalk. Soon he saw Carl coming to help. He was very concerned.,Carl was very concerned.,1,157,entailment,1000157
"Paul tried to call George on the phone, but he wasn't available.",Paul wasn't available.,0,605,not entailment,1000605
"Then Dad figured out how much the man owed the store; to that he added the man's board-bill at the cook-shanty. He subtracted that amount from the man's wages, and made out his check",The man subtracted that amount from the man's wages.,0,267,not entailment,1000267
"It was a summer afternoon, and the dog was sitting in the middle of the lawn. After a while, it got up and moved to a spot under the tree, because it was cooler.",The spot under the tree was cooler.,1,466,entailment,1000466
"The sack of potatoes had been placed above the bag of flour, so it had to be moved first.",The sack of potatoes had to be moved first.,1,316,entailment,1000316
"Jane knocked on Susan's door, but there was no answer. She was disappointed.",Susan was disappointed.,0,574,not entailment,1000574
"During a game of tag, Ethan ran from Luke because he was ""it"".","Luke was ""it"".",1,331,entailment,1000331
Fred watched TV while George went out to buy groceries. After an hour he got back.,Fred got back.,0,530,not entailment,1000530
Sam Goodman's biography of the Spartan general Xenophanes conveys a vivid sense of the difficulties he faced in his research.,Sam Goodman's biography of the Spartan general Xenophanes conveys a vivid sense of the difficulties Goodman faced in his research.,1,197,entailment,1000197
"Since it was raining, I carried the newspaper in my backpack to keep it dry.",I carried the newspaper in my backpack to keep the backpack dry.,0,625,not entailment,1000625
"It is not easy to space buttonholes exactly the same distance apart, and it is very difficult to cut them precisely the right size. The tiniest slip of the scissors will make the hole too large, and even one thread uncut will leave it too small.",Even one thread uncut will leave one thread too small.,0,191,not entailment,1000191
"When Tommy dropped his ice cream, Timmy giggled, so father gave him a sympathetic look.",Father gave Tommy a sympathetic look.,1,205,entailment,1000205
Pete envies Martin although he is very successful.,Pete is very successful.,1,489,entailment,1000489
Kirilov ceded the presidency to Shatov because he was less popular.,Kirilov was less popular.,1,269,entailment,1000269
The trophy doesn't fit into the brown suitcase because it is too large.,The trophy is too large.,1,519,entailment,1000519
Kirilov ceded the presidency to Shatov because he was more popular.,Kirilov was more popular.,0,182,not entailment,1000182
"I stuck a pin through a carrot. When I pulled the pin out, it had a hole.",The carrot had a hole.,1,0,entailment,1000000
"Everyone really loved the oatmeal cookies; only a few people liked the chocolate chip cookies. Next time, we should make more of them.",We should make more of the chocolate chip cookies.,0,241,not entailment,1000241
Grace was happy to trade me her sweater for my jacket. She thinks it looks dowdy on her.,The jacket looks dowdy on her.,0,181,not entailment,1000181
Bill passed the gameboy to John because his turn was next.,Bill's turn was next.,0,147,not entailment,1000147
The firemen arrived after the police because they were coming from so far away.,The police were coming from so far away.,0,13,not entailment,1000013
"The cat was lying by the mouse hole waiting for the mouse, but it was too impatient.",The mouse was too impatient.,0,240,not entailment,1000240
"The actress used to be named Terpsichore, but she changed it to Tina a few years ago, because she figured it was easier to pronounce.",Tina was easier to pronounce.,1,550,entailment,1000550
Anna did a lot worse than her good friend Lucy on the test because she had studied so hard.,Lucy had studied so hard.,1,603,entailment,1000603
"Bob was playing cards with Adam and was way ahead. If Adam hadn't had a sudden run of good luck, he would have won.",Bob would have won.,1,462,entailment,1000462
Anna did a lot better than her good friend Lucy on the test because she had studied so hard.,Lucy had studied so hard.,0,178,not entailment,1000178
Tom gave Ralph a lift to school so he wouldn't have to drive alone.,Tom wouldn't have to drive alone.,1,105,entailment,1000105
"Jackson was greatly influenced by Arnold, though he lived two centuries later.",Jackson lived two centuries later.,1,214,entailment,1000214
"Larry, a timid teen-ager, lives with his widowed mother in a Brooklyn housing project. Larry's father, a gang leader, was shot to death; his father's disciple, Antonio, takes Larry under his wing, and quickly molds him into a drug runner.","His father's disciple, Antonio, takes Larry under his wing, and quickly molds Larry into a drug runner.",0,464,not entailment,1000464
"The older students were bullying the younger ones, so we rescued them.",We rescued the younger students.,1,314,entailment,1000314
"I stuck a pin through a carrot. When I pulled the pin out, it left a hole.",The carrot left a hole.,0,159,not entailment,1000159
The city councilmen refused the demonstrators a permit because they feared violence.,The demonstrators feared violence.,0,459,not entailment,1000459
"I sat there feeling rather like a chappie I'd once read about in a book, who murdered another cove and hid the body under the dining-room table, and then had to be the life and soul of a dinner party, with it there all the time.","He had to be the life and soul of a dinner party, with the dinner party there all the time.",0,187,not entailment,1000187
The woman held the girl against her will.,The woman held the girl against the woman's will.,0,503,not entailment,1000503
"Alice tried frantically to stop her daughter from barking at the party, leaving us to wonder why she was behaving so strangely.",Alice's daughter was behaving so strangely.,1,521,entailment,1000521
"The dog chased the cat, which ran up a tree. It waited at the bottom.",The cat waited at the bottom.,0,409,not entailment,1000409
At the Loebner competition the judges couldn't figure out which respondents were the chatbots because they were so advanced.,The judges were so advanced.,0,9,not entailment,1000009
"Bob paid for Charlie's college education, but now Charlie acts as though it never happened. He is very hurt.",Charlie is very hurt.,0,460,not entailment,1000460
Look! There is a minnow swimming right below that duck! It had better get away to safety fast!,The minnow had better get away to safety fast!,1,493,entailment,1000493
"Since Chester was dependent on Uncle Vernon, he couldn't very well marry without his approval",He couldn't very well marry without Chester's approval,0,96,not entailment,1000096
"Alice was dusting the living room and trying to find the button that Mama had hidden. No time today to look at old pictures in her favorite photo album. Today she had to hunt for a button, so she put the album on a chair without even opening it.",She put the album on a chair without even opening the chair.,0,457,not entailment,1000457
The foxes are getting in at night and attacking the chickens. I shall have to kill them.,I shall have to kill The foxes.,1,87,entailment,1000087
"Paul tried to call George on the phone, but he wasn't successful.",Paul wasn't successful.,1,23,entailment,1000023
Susan knows all about Ann's personal problems because she is indiscreet.,Susan is indiscreet.,0,496,not entailment,1000496
"Jackson was greatly influenced by Arnold, though he lived two centuries earlier.",Jackson lived two centuries earlier.,0,115,not entailment,1000115
"Everyone really loved the oatmeal cookies; only a few people liked the chocolate chip cookies. Next time, we should make more of them.",We should make more of the oatmeal cookies.,1,194,entailment,1000194
"The actress used to be named Terpsichore, but she changed it to Tina a few years ago, because she figured it was too hard to pronounce.",Terpsichore was too hard to pronounce.,1,516,entailment,1000516
"Since it was raining, I carried the newspaper over my backpack to keep it dry.",I carried the newspaper over my backpack to keep the newspaper dry.,0,354,not entailment,1000354
"Larry, a timid teen-ager, lives with his widowed mother in a Brooklyn housing project. Larry's father, a gang leader, was shot to death; his father's disciple, Antonio, takes Larry under his wing, and quickly molds him into a drug runner.","His father's disciple, Antonio, takes Larry under his wing, and quickly molds Antonio into a drug runner.",1,347,entailment,1000347
"Since Chester was dependent on Uncle Vernon, he couldn't very well marry without his approval",Chester couldn't very well marry without his approval,1,248,entailment,1000248
"Archaeologists have concluded that humans lived in Laputa 20,000 years ago. They hunted for deer on the river banks.",Prehistoric humans hunted for deer on the river banks.,1,42,entailment,1000042
"Sam and Amy are passionately in love, but Amy's parents are unhappy about it, because they are snobs.",Sam and Amy are snobs.,0,303,not entailment,1000303
I poured water from the bottle into the cup until it was empty.,The cup was empty.,0,15,not entailment,1000015
"Grant worked hard to harvest his beans so he and his family would have enough to eat that winter, His friend Henry let him stack them in his barn where they would dry. Later, he and Tatyana would shell them and cook them for their Sunday dinners.",His friend Henry let him stack the beans in his barn where they would dry.,1,253,entailment,1000253
"Bernard, who had not told the government official that he was less than 21 when he filed for a homestead claim, did not consider that he had done anything dishonest. Still, anyone who knew that he was 19 years old could take his claim away from him.",Anyone who knew that he was 19 years old could take his claim away from the government official.,0,126,not entailment,1000126
"Beth didn't get angry with Sally, who had cut her off, because she stopped and counted to ten.",Beth stopped and counted to ten.,1,538,entailment,1000538
"The sun was covered by a thick cloud all morning, but luckily, by the time the picnic started, it was gone.",The cloud was gone.,1,581,entailment,1000581
Sam Goodman's biography of the Spartan general Xenophanes conveys a vivid sense of the difficulties he faced in his research.,Sam Goodman's biography of the Spartan general Xenophanes conveys a vivid sense of the difficulties Xenophanes faced in his research.,0,337,not entailment,1000337
"Dan took the rear seat while Bill claimed the front because his ""Dibs!"" was slow.","Dan took the rear seat while Bill claimed the front because Dan's ""Dibs!"" was slow.",1,586,entailment,1000586
The scientists are studying three species of fish that have recently been found living in the Indian Ocean. They appeared two years ago.,The fish appeared two years ago.,1,577,entailment,1000577
Grace was happy to trade me her sweater for my jacket. She thinks it looks great on her.,The jacket looks great on her.,1,560,entailment,1000560
"By rolling over in her upper berth, Tatyana could look over the edge of it and see her mother plainly. How very small and straight and rigid she lay in the bunk below! Her eyes were closed, but Tatyana doubted if she slept.",Tatyana doubted if Tatyana slept.,0,628,not entailment,1000628
"Susan knew that Ann's son had been in a car accident, because she told her about it.",Susan told her about it.,0,247,not entailment,1000247
"Bob paid for Charlie's college education, but now Charlie acts as though it never happened. He is very ungrateful.",Charlie is very ungrateful.,1,430,entailment,1000430
The scientists are studying three species of fish that have recently been found living in the Indian Ocean. They began two years ago.,The fish began two years ago.,0,335,not entailment,1000335
John hired Bill to take care of him.,John hired Bill to take care of Bill.,0,270,not entailment,1000270
"I stuck a pin through a carrot. When I pulled the pin out, it had a hole.",The pin had a hole.,0,495,not entailment,1000495
"Jane knocked on Susan's door, but there was no answer. She was out.",Susan was out.,1,504,entailment,1000504
Dr. Adams informed Kate that she had retired and presented several options for future treatment.,Kate had retired and presented several options for future treatment.,0,472,not entailment,1000472
"In July, Kamtchatka declared war on Yakutsk. Since Yakutsk's army was much better equipped and ten times larger, they were defeated within weeks.",Yakutsk was defeated within weeks.,0,114,not entailment,1000114
"Stretching her back, the woman smiled at the girl.","Stretching the woman's back, the woman smiled at the girl.",1,514,entailment,1000514
I put the cake away in the refrigerator. It has a lot of leftovers in it.,The cake has a lot of leftovers in it.,0,128,not entailment,1000128
"Pam's parents came home and found her having sex with her boyfriend, Paul. They were furious about it.",Pam's parents were furious about it.,1,92,entailment,1000092
"The sack of potatoes had been placed below the bag of flour, so it had to be moved first.",The bag of flour had to be moved first.,1,195,entailment,1000195
"Mark became absorbed in Blaze, the white horse. He was afraid the stable boys at the Burlington Stables struck at him and bullied him because he was timid, so he took upon himself the feeding and care of the animal.",Mark took upon himself the feeding and care of the animal.,1,386,entailment,1000386
"In the storm, the tree fell down and crashed through the roof of my house. Now, I have to get it removed.",Now I have to get The roof removed.,0,490,not entailment,1000490
This book introduced Shakespeare to Goethe; it was a major influence on his writing.,It was a major influence on Goethe's writing.,1,377,entailment,1000377
The large ball crashed right through the table because it was made of steel.,The table was made of steel.,0,252,not entailment,1000252
The man couldn't lift his son because he was so weak.,The man was so weak.,1,94,entailment,1000094
John was jogging through the park when he saw a man juggling watermelons. He was very impressed.,The juggler was very impressed.,0,364,not entailment,1000364
